{"meta":{"id":"bw_acknowledgement_2c864da3d1efde131fcec169e5866f14","schemaVersion":"boreal.runtime.v1","createdAt":"2026-07-02T06:06:09.968Z","updatedAt":"2026-07-02T06:06:09.968Z","createdBy":{"id":"cybertron","kind":"human","displayName":"cybertron"},"updatedBy":{"id":"cybertron","kind":"human","displayName":"cybertron"},"sourceRefs":[],"tags":["directive-acknowledgement","satisfied"],"contentHash":"sha256:e690c93b31d52782ace70a14f220d85f5feb8b922c14f435502163806e04c26f"},"directiveId":"directive.git.checkpoint-required.c168efdd5c54","directiveVersion":"v1","directiveRegistryId":"git.checkpoint-required","bundleSource":{"bundleId":"bundle.agent.finish.c168efdd5c54","registryVersion":"directives.v1","commandPath":"agent finish","envelopeSchema":"boreal.cli.agent.finish.v1","sourceSnapshotHash":"sha256:c168efdd5c54bb844598cf7db706fe19973fd143ea539897910602fae3dfa5cf","generatedAt":"2026-07-02T06:05:14.926Z"},"actor":{"id":"cybertron","kind":"human","displayName":"cybertron"},"subjectType":"work","subjectId":"bw_work_6d84e592ce2e9e63","subjectTitle":"Collapse directive taxonomy to blocking required advisory","commandPath":"agent finish","outcome":"satisfied","evidenceIds":["bw_evidence_8d762822fcb70a21"],"agentSummaryIds":["bw_summary_db7a4e72ad474013"],"verificationIds":["bw_verification_dd61e5152d8ba662"],"artifactUris":["memory://agent-summaries/works/bw_work_6d84e592ce2e9e63/bw_summary_db7a4e72ad474013.md"],"handoffIds":[],"reasonCode":"git_unavailable","reason":"Git checkpoint accepted via dirty-path note because sandbox denied creating .git/index.lock during git add.","acknowledgedAt":"2026-07-02T06:06:09.968Z"}
