{"meta":{"id":"bw_acknowledgement_b4e8e663c66061daaecfeb0b4add0457","schemaVersion":"boreal.runtime.v1","createdAt":"2026-07-02T06:35:36.862Z","updatedAt":"2026-07-02T06:35:36.862Z","createdBy":{"id":"cybertron","kind":"human","displayName":"cybertron"},"updatedBy":{"id":"cybertron","kind":"human","displayName":"cybertron"},"sourceRefs":[],"tags":["directive-acknowledgement","satisfied"],"contentHash":"sha256:be6d05efa72a71b737b795ef4562ea7867b2a8ef46f7cca864b14d2a8bd678b5"},"directiveId":"directive.doctor.recovery-required.6c3c09cf9f3b","directiveVersion":"v1","directiveRegistryId":"doctor.recovery-required","bundleSource":{"bundleId":"bundle.agent.finish.6c3c09cf9f3b","registryVersion":"directives.v1","commandPath":"bwrk operation prune --keep 1000 --json; bwrk sync refresh --json; bwrk doctor --strict --json","envelopeSchema":"boreal.cli.agent.finish.v1","sourceSnapshotHash":"sha256:6c3c09cf9f3b71b63b814b06935259196d54059d427d35526e4f25ad75db7c75","generatedAt":"2026-07-02T06:34:41.153Z"},"actor":{"id":"cybertron","kind":"human","displayName":"cybertron"},"subjectType":"sprint","subjectId":"bw_work_a5f6cd2e0899f7b4","subjectTitle":"Sprint 4 - declared done-gates tier 1","commandPath":"bwrk operation prune --keep 1000 --json; bwrk sync refresh --json; bwrk doctor --strict --json","outcome":"satisfied","evidenceIds":["bw_evidence_b322d0dadb17a2de"],"agentSummaryIds":["bw_summary_fe685cca7ab01a70"],"verificationIds":["bw_verification_1a91f63ab982b46f"],"artifactUris":["memory://agent-summaries/sprints/bw_work_a5f6cd2e0899f7b4/bw_summary_fe685cca7ab01a70.md"],"handoffIds":[],"reasonCode":"doctor_recovered","reason":"Ran operation prune, sync refresh, and strict doctor after Sprint 4 closeout; strict doctor passed.","acknowledgedAt":"2026-07-02T06:35:36.862Z"}
